{
  "schema": "ipfs_accelerate_py/agent-supervisor/state-transition-table@1",
  "version": 1,
  "states": ["discovered", "admitted", "ready", "claimed", "dispatched", "provider_starting", "provider_running", "provider_completed", "provider_outcome_unknown", "validating", "validation_failed", "validation_succeeded", "rescue_pending", "retry_pending", "merge_pending", "merging", "reconciliation_pending", "terminal_succeeded", "terminal_failed", "quarantined", "compensated"],
  "events": ["claim", "dispatch", "provider_start", "provider_completion", "provider_timeout", "provider_connection_loss", "validation_start", "validation_result", "rescue", "retry", "merge", "merge_conflict", "reconciliation", "terminalization", "owner_loss", "owner_restart", "lease_expiry", "fence_takeover", "confirmation_grant", "confirmation_expiry", "policy_change", "state_recovery"],
  "terminal_states": ["terminal_succeeded", "terminal_failed", "quarantined", "compensated"],
  "authority": {"mode": "descriptive_only", "mutation_authority": "IntentRepository"},
  "policy_time_semantics": {"dispatch_guard": "policy_authorized_at_event_time", "policy_change_guard": "policy_change_is_nonretroactive"},
  "invariants": ["single_authoritative_owner", "revision_cas", "idempotency_key_for_effects", "fresh_lease_and_fence", "unknown_outcome_reconciliation", "single_terminalization", "current_validation_before_merge", "external_effect_preservation", "deterministic_owner_restart", "event_materialized_state_reconciliation", "receipt_required_success", "failed_validation_cannot_merge_to_success", "nonretroactive_policy_changes"],
  "legacy_status_mappings": {
    "todo": "discovered", "queued": "discovered", "proposed": "discovered", "admitted": "admitted", "pending": "ready", "ready": "ready", "retrying": "retry_pending", "claimed": "claimed", "in_progress": "provider_running", "running": "provider_running", "processing": "provider_running", "blocked": "quarantined", "on_hold": "quarantined", "completed": "terminal_succeeded", "complete": "terminal_succeeded", "done": "terminal_succeeded", "skipped": "terminal_failed", "failed": "terminal_failed", "rejected": "terminal_failed", "cancelled": "terminal_failed", "quarantined": "quarantined"
  },
  "transitions": [
    {"id": "admit_discovered", "event": "state_recovery", "source_states": ["discovered"], "target_state": "admitted", "guards": ["transition_service_only", "revision_cas_matches", "policy_authorized_at_event_time", "durable_discovery_record_present"]},
    {"id": "claim_ready", "event": "claim", "source_states": ["ready"], "target_state": "claimed", "guards": ["transition_service_only", "revision_cas_matches", "policy_authorized_at_event_time", "single_authoritative_owner", "fresh_lease_and_fence"]},
    {"id": "confirmation_expiry_admitted", "event": "confirmation_expiry", "source_states": ["admitted"], "target_state": "admitted", "guards": ["transition_service_only", "revision_cas_matches", "policy_authorized_at_event_time", "confirmation_no_longer_current"]},
    {"id": "confirmation_expiry_ready", "event": "confirmation_expiry", "source_states": ["ready"], "target_state": "admitted", "guards": ["transition_service_only", "revision_cas_matches", "policy_authorized_at_event_time", "confirmation_no_longer_current"]},
    {"id": "confirmation_grant", "event": "confirmation_grant", "source_states": ["admitted"], "target_state": "ready", "guards": ["transition_service_only", "revision_cas_matches", "policy_authorized_at_event_time", "confirmation_grant_current"]},
    {"id": "dispatch_claimed", "event": "dispatch", "source_states": ["claimed"], "target_state": "dispatched", "guards": ["transition_service_only", "revision_cas_matches", "policy_authorized_at_event_time", "fresh_lease_and_fence", "idempotency_key_bound"]},
    {"id": "fence_takeover_reconciled", "event": "fence_takeover", "source_states": ["reconciliation_pending"], "target_state": "claimed", "guards": ["transition_service_only", "revision_cas_matches", "policy_authorized_at_event_time", "reconciliation_observation_required", "fresh_lease_and_fence", "external_effect_preserved"]},
    {"id": "lease_expiry_active", "event": "lease_expiry", "source_states": ["claimed", "dispatched", "provider_starting", "provider_running", "validating", "merge_pending", "merging"], "target_state": "reconciliation_pending", "guards": ["transition_service_only", "revision_cas_matches", "policy_authorized_at_event_time", "fresh_lease_and_fence", "external_effect_preserved"]},
    {"id": "merge_conflict", "event": "merge_conflict", "source_states": ["merging"], "target_state": "retry_pending", "guards": ["transition_service_only", "revision_cas_matches", "policy_authorized_at_event_time", "fresh_lease_and_fence", "external_effect_preserved"]},
    {"id": "merge_pending", "event": "merge", "source_states": ["validation_succeeded"], "target_state": "merge_pending", "guards": ["transition_service_only", "revision_cas_matches", "policy_authorized_at_event_time", "fresh_lease_and_fence", "current_validation_evidence"]},
    {"id": "merge_start", "event": "merge", "source_states": ["merge_pending"], "target_state": "merging", "guards": ["transition_service_only", "revision_cas_matches", "policy_authorized_at_event_time", "fresh_lease_and_fence", "current_validation_evidence", "idempotency_key_bound"]},
    {"id": "owner_loss_active", "event": "owner_loss", "source_states": ["claimed", "dispatched", "provider_starting", "provider_running", "validating", "merge_pending", "merging"], "target_state": "reconciliation_pending", "guards": ["transition_service_only", "revision_cas_matches", "policy_authorized_at_event_time", "external_effect_preserved"]},
    {"id": "owner_restart_reconciles", "event": "owner_restart", "source_states": ["reconciliation_pending"], "target_state": "reconciliation_pending", "guards": ["transition_service_only", "revision_cas_matches", "policy_authorized_at_event_time", "durable_state_reconstructed", "reconciliation_observation_required"]},
    {"id": "policy_change_admitted", "event": "policy_change", "source_states": ["admitted"], "target_state": "admitted", "guards": ["transition_service_only", "revision_cas_matches", "policy_change_is_nonretroactive"]},
    {"id": "policy_change_discovered", "event": "policy_change", "source_states": ["discovered"], "target_state": "discovered", "guards": ["transition_service_only", "revision_cas_matches", "policy_change_is_nonretroactive"]},
    {"id": "policy_change_ready", "event": "policy_change", "source_states": ["ready"], "target_state": "ready", "guards": ["transition_service_only", "revision_cas_matches", "policy_change_is_nonretroactive"]},
    {"id": "provider_complete", "event": "provider_completion", "source_states": ["provider_running"], "target_state": "provider_completed", "guards": ["transition_service_only", "revision_cas_matches", "policy_authorized_at_event_time", "fresh_lease_and_fence", "idempotency_key_bound", "provider_receipt_observed"]},
    {"id": "provider_connection_loss", "event": "provider_connection_loss", "source_states": ["provider_starting", "provider_running"], "target_state": "provider_outcome_unknown", "guards": ["transition_service_only", "revision_cas_matches", "policy_authorized_at_event_time", "idempotency_key_bound", "external_effect_preserved"]},
    {"id": "provider_start_dispatch", "event": "provider_start", "source_states": ["dispatched"], "target_state": "provider_starting", "guards": ["transition_service_only", "revision_cas_matches", "policy_authorized_at_event_time", "fresh_lease_and_fence", "idempotency_key_bound"]},
    {"id": "provider_start_running", "event": "provider_start", "source_states": ["provider_starting"], "target_state": "provider_running", "guards": ["transition_service_only", "revision_cas_matches", "policy_authorized_at_event_time", "fresh_lease_and_fence", "idempotency_key_bound", "provider_start_receipt_observed"]},
    {"id": "provider_timeout", "event": "provider_timeout", "source_states": ["provider_starting", "provider_running"], "target_state": "provider_outcome_unknown", "guards": ["transition_service_only", "revision_cas_matches", "policy_authorized_at_event_time", "idempotency_key_bound", "external_effect_preserved"]},
    {"id": "reconcile_observed_completion", "event": "reconciliation", "source_states": ["reconciliation_pending"], "target_state": "provider_completed", "guards": ["transition_service_only", "revision_cas_matches", "policy_authorized_at_event_time", "reconciliation_observation_required", "provider_receipt_observed", "external_effect_preserved"]},
    {"id": "reconcile_retry", "event": "reconciliation", "source_states": ["reconciliation_pending"], "target_state": "retry_pending", "guards": ["transition_service_only", "revision_cas_matches", "policy_authorized_at_event_time", "reconciliation_observation_required", "no_external_effect_observed", "external_effect_preserved"]},
    {"id": "reconcile_unknown", "event": "reconciliation", "source_states": ["provider_outcome_unknown"], "target_state": "reconciliation_pending", "guards": ["transition_service_only", "revision_cas_matches", "policy_authorized_at_event_time", "reconciliation_observation_required", "idempotency_key_bound", "external_effect_preserved"]},
    {"id": "rescue_validation_failure", "event": "rescue", "source_states": ["validation_failed"], "target_state": "rescue_pending", "guards": ["transition_service_only", "revision_cas_matches", "policy_authorized_at_event_time", "fresh_lease_and_fence", "external_effect_preserved"]},
    {"id": "retry_rescue", "event": "retry", "source_states": ["rescue_pending"], "target_state": "retry_pending", "guards": ["transition_service_only", "revision_cas_matches", "policy_authorized_at_event_time", "fresh_lease_and_fence", "external_effect_preserved"]},